date,avg_price,rainfall_mm,temp_c,news_headline
2008-01-01,3575.76,3.3,29.0,Government buffer release cools retail rice inflation in urban markets. Logistics delays along main corridors keep wholesale spreads wide. Asia food inflation watch: governments mull release of strategic reserves.
2008-01-02,3575.76,7.5,29.9,Flood alerts along main rivers; warehouse stocks at risk near ports. Diesel prices decline at the pump; logistics firms pass through savings. Port congestion returns; vessel queues delay bulk grain loadings.
2008-01-03,3575.76,11.6,30.8,OPEC+ meeting ends with surprise production increase; crude eases. Drought warning in major growing belt; yield fears support grain quotes.
2008-01-04,3575.76,15.8,31.2,Bumper harvest chatter caps upside despite tight warehouse stocks. Regional buyers return after floods; milled rice moves in thin trade. Monsoon outlook improves for delta plantings; futures drift slightly lower.
2008-01-05,3575.76,4.0,32.1,Cyclone alert issued; coastal states prepare as rice fields face wind risk. Container freight rates increase on Asia-Europe lanes; ag exporters fret. Crude oil prices surge after OPEC signals deeper output cuts next quarter.
2008-01-06,3575.76,8.2,33.0,Oil prices fall as inventories build and demand outlook softens. La Niña watch raises monsoon uncertainty; ag markets trade nervously. Rail bottlenecks ease after ministry intervention; deliveries speed up.
2008-01-07,3575.76,12.3,33.5,Export demand supports local paddy quotes; traders watch policy signals. Corn prices climb as ethanol margins improve and inventories tighten. Normal monsoon forecast lifts planting sentiment; rice prices ease slightly.
2008-01-08,3575.76,16.5,34.4,Sanctions chatter unsettles commodity finance; spreads widen briefly. Freight indices soften as new vessel supply enters the market. Regional buyers return after floods; milled rice moves in thin trade.
2008-01-09,3575.76,4.7,35.3,Crude oil prices surge after OPEC signals deeper output cuts next quarter. Retail inflation cools as vegetable basket prices decline month on month. WTI slides on stronger dollar; energy importers get brief relief.
2008-01-10,3575.76,8.8,29.0,Import parity calculations rise; domestic rice offers firm up. Delta farmers report steady transplant progress; rice quotes unmoved. Sanctions chatter unsettles commodity finance; spreads widen briefly.
2008-01-11,3575.76,13.0,29.9,Central bank holds rates; currency stability supports import parity pricing. Central bank holds rates; currency stability supports import parity pricing. Agricultural futures ease as harvest pressure hits the cash market.
2008-01-12,3575.76,17.2,30.8,Delta farmers report steady transplant progress; rice quotes unmoved. Import parity calculations rise; domestic rice offers firm up. Soybean meal demand lifts grain complex; rice follows sentiment higher.
2008-01-13,3575.76,5.3,31.2,Retail inflation cools as vegetable basket prices decline month on month. Crude oil prices surge after OPEC signals deeper output cuts next quarter. Container freight rates increase on Asia-Europe lanes; ag exporters fret.
2008-01-14,3575.76,9.5,32.1,Freight indices soften as new vessel supply enters the market. Sanctions chatter unsettles commodity finance; spreads widen briefly. Monsoon rains arrive early; irrigation demand drops for paddy farmers.
2008-01-15,3575.76,13.7,33.0,Corn prices climb as ethanol margins improve and inventories tighten. Export demand supports local paddy quotes; traders watch policy signals.
2008-01-16,3577.71,17.8,33.5,La Niña watch raises monsoon uncertainty; ag markets trade nervously. Oil prices fall as inventories build and demand outlook softens. Parboiled rice spreads widen on higher energy and packaging costs.
2008-01-17,3579.66,6.0,34.4,Container freight rates increase on Asia-Europe lanes; ag exporters fret. Cyclone alert issued; coastal states prepare as rice fields face wind risk. Truck strike threat lifted; inland rice movement normalizes.
2008-01-18,3581.62,10.2,35.3,Regional buyers return after floods; milled rice moves in thin trade. Bumper harvest chatter caps upside despite tight warehouse stocks. La Niña watch raises monsoon uncertainty; ag markets trade nervously.
2008-01-19,3583.58,14.4,29.0,Drought warning in major growing belt; yield fears support grain quotes. OPEC+ meeting ends with surprise production increase; crude eases. Heatwave warnings lift irrigation costs; farmgate paddy bids firm.
2008-01-20,3585.53,2.5,29.9,Diesel prices decline at the pump; logistics firms pass through savings. Flood alerts along main rivers; warehouse stocks at risk near ports. Oil prices fall as inventories build and demand outlook softens.
2008-01-21,3587.49,6.7,30.8,Logistics delays along main corridors keep wholesale spreads wide. Government buffer release cools retail rice inflation in urban markets. Parliament debates export curb on staples; rice traders stay cautious.
2008-01-22,3589.44,10.9,31.2,IMF mission notes inflation risks from weather and energy pass-through. Port congestion returns; vessel queues delay bulk grain loadings. Commodity index rallies; energy and grains lead the advance.
2008-01-23,3591.39,15.0,32.1,Fuel costs rise sharply; truckers warn of higher food distribution charges. Normal monsoon forecast lifts planting sentiment; rice prices ease slightly. Corn prices climb as ethanol margins improve and inventories tighten.
2008-01-24,3593.35,3.2,33.0,Rice wholesale steady as mandi arrivals pick up after the holiday. Soybean meal demand lifts grain complex; rice follows sentiment higher. Geopolitical risk premium fades; barrel prices drop for a third session.
